{"type":"object","properties":{"schema_version":{"const":"1.0.0"},"model_version":{"const":"mlr-1.0.0"},"split":{"const":"TRAIN_CV"},"source":{"type":"object","properties":{"path":{"type":"string","pattern":"^(reports|artifacts|configs)/"},"sha256":{"type":"string","pattern":"^[a-f0-9]{64}$"}},"required":["path","sha256"],"additionalProperties":false},"aggregation":{"const":"Five chronological outer folds; RMSE population SD (ddof=0)"},"configurations":{"type":"array","minItems":50,"maxItems":50,"items":{"type":"object","properties":{"experiment_id":{"type":"string"},"candidate_set":{"enum":["deployable27","research28"]},"method":{"enum":["select_k_best","rfe","forward_sfs","lasso","permutation"]},"k":{"type":"string"},"effective_k":{"type":"integer"},"cv_rmse_mean":{"type":"number"},"cv_rmse_std":{"type":"number"},"feature_jaccard_mean":{"type":"number"},"compute_seconds":{"type":"number"},"classification":{"type":"string"}},"required":["experiment_id","candidate_set","method","k","effective_k","cv_rmse_mean","cv_rmse_std","feature_jaccard_mean","compute_seconds","classification"],"additionalProperties":false}}},"required":["schema_version","model_version","split","source","aggregation","configurations"],"additionalProperties":false,"$schema":"https://json-schema.org/draft/2020-12/schema","$id":"urn:smart-home-energy:training-cv:1.0.0"}