{"schema_version":"1.0.0","model_version":"mlr-1.0.0","split":"TRAIN_CV","source":{"path":"reports/evaluation/b2b/feature_selection_results.csv","sha256":"61395d722ce008cbe5b0295bd6f998945e7007d748f31db225f206db02de1827"},"aggregation":"Five chronological outer folds; RMSE population SD (ddof=0)","configurations":[{"experiment_id":"b1-66edba8fbea69ded","candidate_set":"deployable27","method":"select_k_best","k":"10","effective_k":10,"cv_rmse_mean":99.9139775113028,"cv_rmse_std":6.367193757408493,"feature_jaccard_mean":0.6218781218781219,"compute_seconds":0.56977319996804,"classification":"RESEARCH_ONLY"},{"experiment_id":"b1-f39f5ffb728d5287","candidate_set":"deployable27","method":"select_k_best","k":"15","effective_k":15,"cv_rmse_mean":100.66738685502568,"cv_rmse_std":6.887902351443889,"feature_jaccard_mean":0.6659442724458204,"compute_seconds":0.6109335001092404,"classification":"DEPLOYMENT_ELIGIBLE_CONFIGURATION_NOT_SELECTED"},{"experiment_id":"b1-45a9e71691474d6e","candidate_set":"deployable27","method":"select_k_best","k":"20","effective_k":20,"cv_rmse_mean":102.38219685268811,"cv_rmse_std":6.086734815619239,"feature_jaccard_mean":0.6884057971014492,"compute_seconds":0.5936789999250323,"classification":"DEPLOYMENT_ELIGIBLE_CONFIGURATION_NOT_SELECTED"},{"experiment_id":"b1-f87e4e5323deb6f6","candidate_set":"deployable27","method":"select_k_best","k":"25","effective_k":25,"cv_rmse_mean":100.53616995045958,"cv_rmse_std":5.125684486828394,"feature_jaccard_mean":0.8809116809116808,"compute_seconds":0.6404350001830608,"classification":"DEPLOYMENT_ELIGIBLE_CONFIGURATION_NOT_SELECTED"},{"experiment_id":"b1-4f06bb028480e3a4","candidate_set":"deployable27","method":"select_k_best","k":"ALL","effective_k":27,"cv_rmse_mean":100.49794965037479,"cv_rmse_std":5.071018118309174,"feature_jaccard_mean":1.0,"compute_seconds":0.5035708998329937,"classification":"DEPLOYMENT_ELIGIBLE_CONFIGURATION_NOT_SELECTED"},{"experiment_id":"b1-24a699ba94cc1af7","candidate_set":"research28","method":"select_k_best","k":"10","effective_k":10,"cv_rmse_mean":99.58555715705712,"cv_rmse_std":5.300865543905836,"feature_jaccard_mean":0.5775557775557776,"compute_seconds":0.6045887998770922,"classification":"RESEARCH_CONTROL_LIGHTS"},{"experiment_id":"b1-8d0508d370b493f3","candidate_set":"research28","method":"select_k_best","k":"15","effective_k":15,"cv_rmse_mean":101.32510648528115,"cv_rmse_std":5.468148473544526,"feature_jaccard_mean":0.6474587203302373,"compute_seconds":0.6249585999175906,"classification":"RESEARCH_CONTROL_LIGHTS"},{"experiment_id":"b1-2eb37cc63b70dd1e","candidate_set":"research28","method":"select_k_best","k":"20","effective_k":20,"cv_rmse_mean":102.18966790481905,"cv_rmse_std":5.064865204108317,"feature_jaccard_mean":0.680053569618787,"compute_seconds":0.6147154993377626,"classification":"RESEARCH_CONTROL_LIGHTS"},{"experiment_id":"b1-e08f9a0736d78653","candidate_set":"research28","method":"select_k_best","k":"25","effective_k":25,"cv_rmse_mean":102.32024070383338,"cv_rmse_std":7.317345591575312,"feature_jaccard_mean":0.8666056166056167,"compute_seconds":0.5964224000927061,"classification":"RESEARCH_CONTROL_LIGHTS"},{"experiment_id":"b1-e19779a57447a44a","candidate_set":"research28","method":"select_k_best","k":"ALL","effective_k":28,"cv_rmse_mean":101.63242759310529,"cv_rmse_std":5.946332606154361,"feature_jaccard_mean":1.0,"compute_seconds":0.5055060999002308,"classification":"RESEARCH_CONTROL_LIGHTS"},{"experiment_id":"b1-d74910403f840491","candidate_set":"deployable27","method":"rfe","k":"10","effective_k":10,"cv_rmse_mean":99.86432708878655,"cv_rmse_std":5.51602075422601,"feature_jaccard_mean":0.5600732600732601,"compute_seconds":0.7941455997060984,"classification":"RESEARCH_ONLY"},{"experiment_id":"b1-9417361a21d0603c","candidate_set":"deployable27","method":"rfe","k":"15","effective_k":15,"cv_rmse_mean":99.29878320525174,"cv_rmse_std":5.705361714524197,"feature_jaccard_mean":0.7179437564499483,"compute_seconds":0.7704941004049033,"classification":"DEPLOYMENT_ELIGIBLE_CONFIGURATION_NOT_SELECTED"},{"experiment_id":"b1-b6952fda0db1729d","candidate_set":"deployable27","method":"rfe","k":"20","effective_k":20,"cv_rmse_mean":100.87151551174861,"cv_rmse_std":5.318132855202113,"feature_jaccard_mean":0.7424392998306042,"compute_seconds":0.7672475997824222,"classification":"DEPLOYMENT_ELIGIBLE_CONFIGURATION_NOT_SELECTED"},{"experiment_id":"b1-239a1c46cb27d0d6","candidate_set":"deployable27","method":"rfe","k":"25","effective_k":25,"cv_rmse_mean":100.5324942744388,"cv_rmse_std":5.053768687129498,"feature_jaccard_mean":0.8880341880341881,"compute_seconds":0.695169799728319,"classification":"DEPLOYMENT_ELIGIBLE_CONFIGURATION_NOT_SELECTED"},{"experiment_id":"b1-23f07667e90da673","candidate_set":"deployable27","method":"rfe","k":"ALL","effective_k":27,"cv_rmse_mean":100.49794965037479,"cv_rmse_std":5.071018118309174,"feature_jaccard_mean":1.0,"compute_seconds":0.0,"classification":"DEPLOYMENT_ELIGIBLE_CONFIGURATION_NOT_SELECTED"},{"experiment_id":"b1-cf86d8f91d4b3dd3","candidate_set":"research28","method":"rfe","k":"10","effective_k":10,"cv_rmse_mean":100.23309537153202,"cv_rmse_std":4.903924383298365,"feature_jaccard_mean":0.6736596736596737,"compute_seconds":0.8434460998978466,"classification":"RESEARCH_CONTROL_LIGHTS"},{"experiment_id":"b1-52ac51b7ed67a46d","candidate_set":"research28","method":"rfe","k":"15","effective_k":15,"cv_rmse_mean":100.64102101272655,"cv_rmse_std":6.891872283982152,"feature_jaccard_mean":0.7267156862745098,"compute_seconds":0.7822529000695795,"classification":"RESEARCH_CONTROL_LIGHTS"},{"experiment_id":"b1-9bf06a1798783b72","candidate_set":"research28","method":"rfe","k":"20","effective_k":20,"cv_rmse_mean":102.03236248973761,"cv_rmse_std":6.224615256343968,"feature_jaccard_mean":0.7173913043478259,"compute_seconds":0.7491115001030266,"classification":"RESEARCH_CONTROL_LIGHTS"},{"experiment_id":"b1-321f11751dc8f0c6","candidate_set":"research28","method":"rfe","k":"25","effective_k":25,"cv_rmse_mean":102.0189425074268,"cv_rmse_std":6.485196485836438,"feature_jaccard_mean":0.881929181929182,"compute_seconds":0.6792680001817644,"classification":"RESEARCH_CONTROL_LIGHTS"},{"experiment_id":"b1-19c3c46364cbef06","candidate_set":"research28","method":"rfe","k":"ALL","effective_k":28,"cv_rmse_mean":101.63242759310529,"cv_rmse_std":5.946332606154361,"feature_jaccard_mean":1.0,"compute_seconds":0.0,"classification":"RESEARCH_CONTROL_LIGHTS"},{"experiment_id":"b1-636c7e6879379bf4","candidate_set":"deployable27","method":"lasso","k":"10","effective_k":10,"cv_rmse_mean":98.89649510649826,"cv_rmse_std":5.096906939639486,"feature_jaccard_mean":0.7167832167832169,"compute_seconds":0.682158799842,"classification":"RESEARCH_ONLY"},{"experiment_id":"b1-eaa5b17c19f41c98","candidate_set":"deployable27","method":"lasso","k":"15","effective_k":15,"cv_rmse_mean":100.65049114147575,"cv_rmse_std":6.0334432628019306,"feature_jaccard_mean":0.6398809523809524,"compute_seconds":0.6849414997268468,"classification":"DEPLOYMENT_ELIGIBLE_CONFIGURATION_NOT_SELECTED"},{"experiment_id":"b1-095c3df42e231681","candidate_set":"deployable27","method":"lasso","k":"20","effective_k":20,"cv_rmse_mean":100.66110475479567,"cv_rmse_std":5.603963825434816,"feature_jaccard_mean":0.7078796565753087,"compute_seconds":0.7003219001926482,"classification":"DEPLOYMENT_ELIGIBLE_CONFIGURATION_NOT_SELECTED"},{"experiment_id":"b1-1fbac988e49248f0","candidate_set":"deployable27","method":"lasso","k":"25","effective_k":25,"cv_rmse_mean":101.17508558385968,"cv_rmse_std":5.6478208116226,"feature_jaccard_mean":0.8951566951566953,"compute_seconds":0.7025964001659304,"classification":"DEPLOYMENT_ELIGIBLE_CONFIGURATION_NOT_SELECTED"},{"experiment_id":"b1-5c647918918c6992","candidate_set":"deployable27","method":"lasso","k":"ALL","effective_k":27,"cv_rmse_mean":100.49794965037479,"cv_rmse_std":5.071018118309174,"feature_jaccard_mean":1.0,"compute_seconds":0.0,"classification":"DEPLOYMENT_ELIGIBLE_CONFIGURATION_NOT_SELECTED"},{"experiment_id":"b1-83d75f2922638fe5","candidate_set":"research28","method":"lasso","k":"10","effective_k":10,"cv_rmse_mean":99.43095439056309,"cv_rmse_std":5.138684992194888,"feature_jaccard_mean":0.7608391608391608,"compute_seconds":0.617625999962911,"classification":"RESEARCH_CONTROL_LIGHTS"},{"experiment_id":"b1-9358dd2b8b2659e7","candidate_set":"research28","method":"lasso","k":"15","effective_k":15,"cv_rmse_mean":101.27261672718697,"cv_rmse_std":5.6861664712375095,"feature_jaccard_mean":0.6324211263452749,"compute_seconds":0.6266344003379345,"classification":"RESEARCH_CONTROL_LIGHTS"},{"experiment_id":"b1-434ec51429ba6056","candidate_set":"research28","method":"lasso","k":"20","effective_k":20,"cv_rmse_mean":101.2148244910529,"cv_rmse_std":5.835313507847388,"feature_jaccard_mean":0.6943062734367083,"compute_seconds":0.6735626996960491,"classification":"RESEARCH_CONTROL_LIGHTS"},{"experiment_id":"b1-6fad9ea6bb223a62","candidate_set":"research28","method":"lasso","k":"25","effective_k":25,"cv_rmse_mean":102.30639827300895,"cv_rmse_std":6.508025954615945,"feature_jaccard_mean":0.8808506308506308,"compute_seconds":0.7138815997168422,"classification":"RESEARCH_CONTROL_LIGHTS"},{"experiment_id":"b1-a219abfb9c03ff8b","candidate_set":"research28","method":"lasso","k":"ALL","effective_k":28,"cv_rmse_mean":101.63242759310529,"cv_rmse_std":5.946332606154361,"feature_jaccard_mean":1.0,"compute_seconds":0.0,"classification":"RESEARCH_CONTROL_LIGHTS"},{"experiment_id":"b1-7239b48d8ad43be0","candidate_set":"deployable27","method":"permutation","k":"10","effective_k":10,"cv_rmse_mean":100.64108302020844,"cv_rmse_std":5.076447777894367,"feature_jaccard_mean":0.7606060606060606,"compute_seconds":12.266003800090402,"classification":"RESEARCH_ONLY"},{"experiment_id":"b1-87b5b91fb6912100","candidate_set":"deployable27","method":"permutation","k":"15","effective_k":15,"cv_rmse_mean":105.22318372115879,"cv_rmse_std":11.066943436269815,"feature_jaccard_mean":0.7683